Tweet,Topic
انفصلت الخدمه عني وعشان ارجعها لازم اروح لاقرب فرع بعيد جدا جدا فرع اتصلت بخدمه العملاء وادوني رقم الهاتف الجوال للشؤون القانونيه وقالولي مشكلتك معاهم وافقوا هنرجعلك الخدمه,Customer Service
الشريحه بتاعتي م قصيتها الارقام اختفت اوصل للارقام تاني ؟ ؟,Customer Service
رقم خدمه العملاء,Customer Service
بالنسبه للاعلان الشغال داخل الفروع خارجها ؟,Customer Service
سنترال المطيعه مركز اسيوط محافظه اسيوط بيدعم التوصيل بتاعكم adsl,Customer Service
رقم خدمه العملاء الانترنت,Customer Service
شكوي لفرع السودان سمحتوايرجي,Customer Service
كارفور مدينه نصر بيستبدل,Customer Service
رقم خدمه العملاء ؟ ؟,Customer Service
بخصوص عرض التقسيط بدون فوايد انواع الموبايلات المتاحه وعناوين الفروع القريبه مصر الجديده,Customer Service
سمحتوا حبيت اجيب كشف فاتوره بمكالماتي اجبها الفرع ؟ ؟ ولو كده بتكون حسب اطلبها بمعني اني اختار كشف المكالمات ﻻنهي شهر ؟ ؟ وهل حد يجبهالي ولو حبيت اخلي حد غيري يجبهالي هيحتاج ياخد بطاقتي وﻻ ؟ ؟,Customer Service
حضرتك بالنسبه للناس محافظات بعيده دمياط والسفر تكلفه ومشقه ليهم مقر تاني ؟,Customer Service
يمن دسوق وعندي خط الرضي اوصل نت هل دسوق نت,Customer Service
مسافر وعاوز اوقف الخط شهور الاجراءات,Customer Service
نفسي اشتري خط وكل منافذ البيع الخاصه بقت صيانه وبيع فقط للعلم بكلم قلب الغردقه شارع شيري,Customer Service
رقم خدمه العملاء الدولي ؟ !,Customer Service
اه واجه اشترك تبقي الشبكه مشغوله واتصل بخدمه العملاء مشغوله لحد الرصيد مخلص ويسمعوني موسيقي واغاني,Customer Service
كنت فرع ليا,Customer Service
اتصل خدمه العملاء يقولولي انتظر العملاء مشغولون بالرد عملاء اخرين,Customer Service
كنت اشتري خط الفرعسعره كاموعايز الخطوط الجديده عروض نت ؟ ؟,Customer Service
لما بعمل مكالمه بيقولي ايقاف الخط بناء طلبك ويجب الرجوع للمفوض مطلبتش الحل,Customer Service
mail مبعوت للموظفين غن التدريب الصيفي ضروره املاء اون لاين اقدر اون لاين لاني دخلت عادلي الشركه وملقتش,Customer Service
ينفع حد عنده يجيب خط الشركه لازم اكبر كدا,Customer Service
يا جماعه تليفوني اتسرق وعايزه ارجع الخط اه,Customer Service
سمحتو كنت رقم خدمه العملاء,Customer Service
مواعيدكوا رمضان,Customer Service
خدمه اكلم خدمه العملاء طريق الشات,Customer Service
سعر فلاشه النت وبتتجاب منين وي سعر الاشتراق الشهري ولو بشتريها فرع فرعكوا فين الفرع لي فيل مقطم,Customer Service
التغطيه النت عندنا منطقه كفر الشيخ ودسوق بالتحديد ضعيفه شويه اذنكم تشوفوا المشكله وترجع الشبكه حلوه,Customer Service
"I had a big problem with your customer service they are incompetent and rude Today i charged a prepaid card for a friend abroad with EGP , they deducted without any reason and when i called to ask they said its a confidential reason ! I need a reSponse before going to consumer protection !",Customer Service
مركز كايرو فاستيفال فاتح,Customer Service
التحويل الشرطي والديها,Customer Service
سمحتوا خطي اسابيع ومش عارف فيريت تشغلوه اروح فرع,Customer Service
بتبقي مواعيده وازاي نشترك وايه شروطه ؟,Customer Service
السلام عليكم ورحمه الله وبركاته الساده الافاضل خدمه عملاء اشتريت خطين بقسيمه ( فاتوره ) ولظروف خاصه لقيت اتباع والاخر لااعلم عنه هل مساله قانونيه شكرا,Customer Service
منفذ بيع اجيد القراه الكتابه واجيد التعامل الحاسب الالي وخدمه العملاء وشكرا,Customer Service
سمحتو جت لي رساله تطلب مني تجديد البيانات واتصلت واعطيتهم الرقم القومي وبعدين قالو لي لازم تروح الفرع,Customer Service
السلام عليكم حضرتك فرع محافظه المنيا مركز مغاغه,Customer Service
اتصلت بخدمه العملاء وكل يقولو هنتصل بيك حد بيسال مشكله حصلت معايا فات حد اهتم,Customer Service
الهاتف الخاص بي يطلب بطاقه uim يتم تشغيل g هل لديكم النوع البطاقات ؟,Customer Service
دلوقت عملت رقم pin ونسيت الرقم وقعت اجرب لغايه لما ظهرلي رفض البطاقه,Customer Service
مش عارفه اقدم النت ينفع اقدم cv بتاعي لاي فرع قريب مني ؟ ؟ مش هينفع ؟ ؟ يوصلكوا cv ؟ ؟,Customer Service
يوجد وظائف كول سنتر لطلاب,Customer Service
بالنسبه للكارت المدفوع مقدما المفروض اعمله علشان احافظ صلاحيه الخط الشحن باستخدام كروت شحن لازم اد عادي تحويل رصيد واجراء المكالمات الرسايل اد علشان احافظ صلاحيه خطي وشكرا,Customer Service
ياخد موزع معتمد فرع الاوراق المطلوبه واتحرك ؟ ؟,Customer Service
معاد معين للحضور بيكون مقر معين فرع مشكله,Customer Service
اشتريت شريحه بالبطاقه وشحنت اتكلم بيقولي يجب نفعيل الشريحه ! افعل الشريحه ؟ ؟,Customer Service
مشكله الخط بتاعي مبيطلبش كود بيبدابالنجمه شباك,Customer Service
حضرتك الخط بتاعي واقع مني ازي البيانات ازي,Customer Service
تنزل اسعار الموبايلات سامسونج وهواوي كلها ومين الاحلي فيهم ياريت بسرعه,Customer Service
غندي خط فلاشه نت بقالي سنتين مشغلتهوش,Customer Service
يا جماعه احترامي ليكم انتو بتقولو رجع خطك القديم ماستخدمتوش شهور خط شلته لمده شهر وبعد لما اشغله قالي يتم تسجيل البطاقه,Customer Service
الفروع القريبه قاعه المؤتمرات المتوافر المنتج للشراء ؟ ؟,Customer Service
معايا خط ومش عارف اشغله عرض وجاي رساله تنظيم,Customer Service
مشكله الشركه واتمني حد يحلها,Customer Service
رقم خدمه العملاء ضروري جدا جدا جدا جدا,Customer Service
بيانات رقم عطان بيغلس ناس اعرفه فين وعايز اقفله الخط,Customer Service
معايا خط وبقالي شهر مشغلتوش بيديني بالخدمه العمل علشان الخط يرجع تاني ؟ وشكرا,Customer Service
خط وبعدين الخط اتكسر فتره طويله جدا روحت قالي الخط اتوقف والخط دا مرتبط بيه حاجات ياما حل اني ارجعه تاني,Customer Service
سمحتوا خط قديم اشغلو تاني ؟ لما اجي اتصل ( مسجل الشبكه ),Customer Service
محتاجه حد خدمه العملاء متشلش,Customer Service
مشكله شاري خط جديد فمركز خدمه عملاء وكتبت العقد وكل ومشيت وكل ماجي اتصل باي رقم يجيلي رساله صوتيه زور فرع لتفعيل الخط نرجو حل المشكله,Customer Service
حضرتك شحنت كارتين جنيه اتخصموا بدون سبب وكل اكلم خدمه العملاء يقولي شويه ه كلمني بحجه مختلفه,Customer Service
ياجماعه حد يساعدني استخدم هيا خدمه العملاء,Customer Service
ياافندم نركب راوتر خط تليفون كبسوله الشارع ساكن الحل ولكم جزيل الشكر,Customer Service
عملت حساب جديد هنسيت كلمه المرور وطلبتها وجالي البريد الالكتروني وكلمه المرور الجديده وبدخلهم بيقولي خطا كلمه المرور اسم المستخدم الحل ولو امسح الحساب واعمل بدالوا جديد امسحه تسجيل دخول,Customer Service
مواعيد العمل امته فروع ؟ وشكرا,Customer Service
huawei ascend mate gold فرع وبكام واقدر اوصله ؟ ؟,Customer Service
ترجيع الخط,Customer Service
اشتري السامسونج بالقسط شهر كده شهر شهر بيبقي مقدم,Customer Service
الخط اتوقف وعايز اشغله تاني ؟ ؟,Customer Service
اشتريت خط محل ومحتاجه اسجله اسجله ؟,Customer Service
كلمت خدمه العملا ومحدش افادني بحاجه,Customer Service
اسجل الخط باسمي مشتريه فتره طويله والعلبه بتاعته ضاعت ؟ ؟,Customer Service
اكلم حد خدمه العملا الرقم اتصل بيه ؟,Customer Service
محتاجه رد منكم ضروري اكونت بيعمل اعلان وظائف للشركه ؟ ؟ اكونت عامل اعلان وطلب cv وصور للبطاقه وشهاده الميلاد وشهاده التخرج الانترفيو اصلا وقبل,Customer Service
شركه صغيره فرد اعملهم خطوط مسلسله ياريت حد يرد عليا,Customer Service
هوا استقبال المكالمات بيجدد صلاحيه الخط لازم مكالمه اجدد صلاحيه الخط,Customer Service
معايا خط بقاله ومش سجلته ينفع اسجله طريق الموبيل ولالا,Customer Service
حد خدمه العملء,Customer Service
نزلت اشتري خط تاني قالولي الخطوط موقوفه البحر الاحنر فعلا كده,Customer Service
شركه كبيره وتنساني وما اخدش هديتي دا عميل مميز شوفو حل للمشكله,Customer Service
كلمه خدمه العملاء وهما قالو هنحولك للدعم الفني والخط قطع كد حرام انتظار دقيه,Customer Service
الخط بتاعي مكتوب اختي احوله لاسمي ينفع اخد بطاقتها واروح الفرع,Customer Service
الفواتير علشان اوقف الخدمه,Customer Service
كنت اكلم حد الشركه خاص ضروري,Customer Service
حجز الارقام رقم مميز كلاب,Customer Service
حضرتك مشكله الخط وكل اكلم خدمه العملاء يقولي لاحقا ومش عارف,Customer Service
الشريحه خاليه تماما ومش بتقبل اسامي,Customer Service
حضرتك الخط بتاعي قفل خالص وعاوز تحديث بينات وكل خط تاني مطلوب تحديث بينات,Customer Service
مواعيد الفروع تفتح الساعه,Customer Service
السﻻم عليكم محدث بيناتي دقائق ومعنديش فرع اتصاﻻت علشان استكمل البيانات,Customer Service
كارت الشحن اتخدش منه اربع ارقام ؟,Customer Service
الخط بتاعي ضاع كنت خط جديد بنفس الرقم,Customer Service
عناوين فروع موجوده المنصوره اسجل خطي ؟,Customer Service
استبدلت شريحه وكل ماجي اسجل اسم الشريحه يقولي الذاكره ممتلئه الحل وبيجيلي طول دايما خطا تسجيل الشبكه,Customer Service
واكلم ترجعوا الخط للي سرقتوه ؟ !,Customer Service
فرع كفرالشيخ ؟,Customer Service
كنت حاجز رقم الموقع ومش عارف هيجي فرع ؟ ؟,Customer Service
مشكله usbمودم مشغال هل صيانه فرع,Customer Service
مشكله شريحه لما اتصل بيها حد يقفل ويديني مشغول واذا حد اتصل عليا يديلو مشغول برضو واذا اتصلت بخدمه العمله يديني مشغول الموضوع بقالو شهر وقفت حالي خالص,Customer Service
رقم خدمه العملاء النت فاصل والحكايه بتتكر كتير,Customer Service
هل متوفر الفروع عندكم موبايل انفينكس نوت برو اللون الفضي,Customer Service
رقم خدمه عملاء الارضي,Customer Service
حضرتك المقر الرئيسي الاسماعيليه فين بالظبط,Customer Service
اشغل خدمه اضعاف شحنتي ! ! ببعت رساله ل ومش اشتغل,Customer Service
كنت اسئل فروع لحضراتكم متاح شغل للطلبه اذنك,Customer Service
خدمه العملاء رقمها,Customer Service
ارجع الشريحه بتاعتي والرسوم استرجاع الشريحه,Customer Service
اعﻻن وظائف اتصاﻻت صح وﻻﻻ وفرع اسوان,Customer Service
السلام عليكم خدمه عملاء,Customer Service
الدعم الفني انترنت,Customer Service
سعر huawei y واقرب فرع اجيب منه,Customer Service
مشكله اشتريت خط اتصﻻت واريد اسجله باسمي واتصلت بخدمه العمﻻء لي اذهبي مركز خدمه العملاء وذهبت لي ﻻ يقدر ﻷنه مسجل شخص ثاني ماذا افعل,Customer Service
اشتريت خط خارج مصر وبقالي شهور يستعمل واعتقد اتقفل ارجعه تاني العلم ارقام مهمه ورصيد كبير الاجراءات واذاي اتصل بخدمه العملاء خط تاني للتواصل معهم,Customer Service
المكان انتر فيوه اشتغل خدمه عملاء,Customer Service
بعت رساله الابلكيشن بتاعكم فتره ومحدش عبرني اسميه سوء خدمه عملاء اسميه اهتمام اسميه ابقي عارف واتكلمت امبارح قالوا حد هيرد عليك ومحدش عبرنا ! !,Customer Service
السلام عليكمهوا احول خطي بنفس الرقم شبكه تانيه لاتصالات لازم اروح الفرع طريقه تانيه وشكرا,Customer Service
اتخصم مني جنيه بلغي الباقه وبعمل واحده تانيه فنفس وكلمت خدمه العملاء قالولي اتخصمت,Customer Service
موبايلي اتسرق وعاوزه ارجع الخط والمشكله الفرع بتاعكم بعيد البيت الحل,Customer Service
رقم خدمه العملاء لان الشريحه اغلاقها دائم لان ابني الصغير ادخل رقم PUK مرات خطا وعندما حاولت ادخل الرقم الخط الرساله الشريحه اغلاقها دائم الحل وشكرا,Customer Service
فضلك خطي واقف واتصلت بخدمه العملاء وعملولي استبدال شريحه واتسجلت البيانات باسمي هل اسجل الخط زوجتي تسجيله باسمي العلم اني مجبتش الشريحه وشكرا,Customer Service
سعر مكالمه خدمه عملاء تانك ؟,Customer Service
الخير رقم خدمه العملاء,Customer Service
اسكندريه ونزلت امبارح اغلي فرعكوا لقيتو قفلين اقدم روتر فرع فاتح انهارده,Customer Service
مانا هروح للفرع واثبتلهم الخط بتاعي,Customer Service
للتقديم ستور Etisalat Misr طريق ؟ ؟,Customer Service
فضلك فرع للاتصالات سكنه شارع جمال عبد الناصر الحرفين مدينه السلام,Customer Service
اشتغل فرع بدرس,Customer Service
جبت راوتر والخدمه اشتغلت مارس والمفروض ادفع جنيه لان جايب خط ميجا عرض شهور روحت امبارح دفعت كلمت خدمه العملاء ويقولو هنحولك قسم الفواتير ويقفلو الخط ومحدس معرفني ادفع بالضبط وليه وهيه ؟,Customer Service
اقدم شغل خدمه العملاء,Customer Service
هل I phone plus فروع ؟ وبكام ؟ ؟,Customer Service
اسال ومتقوليش زور الموقع اققرب فرع تعبت الزيارات عملت عندكوا احول بنفس الرقم واخدت شريحه وقالي هيشتغل عدي ولسه متحولش يبقي,Customer Service
خطي اتوقف وعايز ارجعه ولما اجي اتصل بخدمه العملاء بيجيبلي طواريء,Customer Service
احلي شبكه وافضل خدمه عملاء شكرا لكل العاملين مجهود رائع,Customer Service
حضرتك ينفع دبلوم سياحه وفنادق يشتغل انجليزي بسيط واعفاء الجيش,Customer Service
الموبايل بتاعي اتسرق وعاوز اوقفو خالص مهما رد,Customer Service
مواعيد العمل داخل فروع خدمه العملاء بحيث ادفع الفاتوره,Customer Service
مواعيد عمل مراكز البيع للشركه رمضان روحت مرتين لاحد الفروع وبيبقي قافل ؟ ؟,Customer Service
اتصلت بخدمه العملاء بتاعتكم وسجلت الرقم بتاعي بالبطاقه لانو مكنش متسجل زمان معايا وقالولي كدا الخط اتسجل روح فرع وسجل العقد رسوم الفرع,Customer Service
شرائح بيانات فرع شربين ؟ فرق شرائح البيانات والصوت بالنسبه شغلتهم انترنت,Customer Service
بقالي فتره مشحنتش خطي شحنت شويه وبتصل بيقفل طول ومش عارف اتصل بخدمه العملا,Customer Service
مكالمه لخدمه العملاء وتسجيل مشكله لقسم الشكاوي يتواصل معي وصلت رساله حل المشكله ومفيش حصلت خدمه يااتصالات,Customer Service
بالنسبه للتقديم شرط ينفع حد يقدم مؤهل فوق متوسط ينطبق الشروط المكتوبه,Customer Service
MEN @TION مصر موجودين امريكانا بلازا ؟ وهل مكان تاني موجودين قريب ؟,Customer Service
اذنك بني سويف ففي فروع لاتصالات معتمده محافظه بني سويف لتعين المحافظه وينفع اققدم للمقابله الشخصيه,Customer Service
مواعيد العمل فروع رمضان خاصه فرع احمد عرابي المهندسين,Customer Service
اذنكم فرع مصطفي النحاس ماك فاتح الصلاه ؟,Customer Service
الخط المميز حضرتك الفرع ?,Customer Service
رقم خدمه العملاء MEN @TION misr,Customer Service
اكلم خدمه العملا,Customer Service
السلام عليكم ورحمه الله وبركاته كيف تتلقي اقتراحات عملائها معني حد عملاء لديه اقتراح للشركه لتقديم خدمه معينه متوفره باقي الشركات المنافسه وتكون شركه السبق تقديم الخدمه وتسهم الخدمه تميز الدائم نتكلم نقدم لهم الاقتراح شكرا مقدما,Customer Service
سمحتوا مواعيد الفروع رمضان فاسوان ؟,Customer Service
السلام عليكم اشتري خط جديد وعايز فرع لي فين القنطره غرب,Customer Service
Etisalat Misr جربت اشترك الكود ابعت رساله قيمه الباقه مشتغلتش وجربت اكلم خدمه العملاء لما حولني عليهم والرساله خلصت المكالمه اتقفلت لوحدها,Customer Service
مواعيد عمل فروع شهر رمضان لكام ؟,Customer Service
كنت شروط تقديم كول ستنر خدمه عملاء للطالبه محافظه السويس ازي ؟ ؟,Customer Service
اشحن خطي بكرت موبيلي سعوديه وعايز رقم خدمه عملاء الرجاء,Customer Service
"السلام عليكم ورحمه الله وبركاته لما ٲجي ٲشترك خدمه ٲضعاف شحنتك بتجيلي الرساله عميلنا العزيز , نتمكن تنفيذ طلبكم برجاء الاتصال بخدمه العملاء ؟ ؟",Customer Service
موبايلي اتسرق وعاوز اروح فرع ارجع الخط الخط لما بيرجع بيبقي الاسامي ? ?,Customer Service
rakm edmeet l omlaa kaam ? ?,Customer Service
معايا خط مسجلتش بياناتي ينفع اكمل بياناتي عالنت ? فرع قريب مني,Customer Service
مشكله لما بتصل باي رقم مبسمعهوش واتصلت بخدمه العمله مرات متحلتش المشكله,Customer Service
خدمه العمﻻء نمرتها,Customer Service
كنت مسجل خط اسمي والفون اتسرق ورحت الخط وقلولي عطل تعالا بعدين اتفاجي دلوقت الخط تاني فين حقي,Customer Service
رقم خدمه العملا ؟,Customer Service
فروع ارقام ؟ ؟ ليها ياريت رقم فرع الدقي ( السرايات ) ؟,Customer Service
ياادمنز مشكله الخط فتره والشركه مقد مقدمتليش حل,Customer Service
ماتصل بخدمه العملاء تفضل تقولي الموظفين مشغولون برد عملاء اخرين ومبوصلش لحد واقفل والمكالمه تتحسب وشكراا كده,Customer Service
حضرتك شبرا الخيمه اروح للفرع المؤسسه ؟ ؟ :],Customer Service
والله الواحد ندمان انو اشتري خط اساسا لما اتصل مرات خدمه العملاء وماحدش عارف يفيدني بخصوص خدمه الفيسبوك المجاني وف الاخر قالي هبعتلك رساله توضحلك تعمل بالظبط وماوصلتش لحد حالا حاولو مصداقيه الناس واحترمو عقولنا شويه وشكرا,Customer Service
الخط بتاعي لما خدمه العملاء حد يجبلي مسجل بالشبكه,Customer Service
معايا كارت شحن اتخدش وضاع منه ارقام قليله مساعده لكي اشحنه ؟,Customer Service
انتوا بتردوش هنا Etisalat Customer Care,Customer Service
ازنكم ياجماعه كونت فرع لكم هنا,Customer Service
المفروض حد يكلمني الشكوي كده اهتمام بالعميل,Customer Service
بصراحه جداجدا فاقد الثقه فيكم اتصلت بخدمه العملاء والمشكله قائمه يفيدوني المشكله باختصار سحب الرصيد,Customer Service
خدمه العملاء اكلمهم مشكله ضروري,Customer Service
سوري كنت بعته اني عوزه الشركه محتاجه تشغل حد الخطوات,Customer Service
خدمه العملا ! ؟,Customer Service
فرع لاتصالات مصر الجديده الحجاز,Customer Service
احصل فرصه عمل بلشركه الفروح,Customer Service
مفيس فرع قريب عبد الخالق ثروت,Customer Service
هوه فروع فاتحه ؟,Customer Service
فروع فاتحه انهارده عندهم اجازه,Customer Service
يمكنكم تشرفونا فرع وهنجوبك استفسارك اقل وقت وشكرا لتعاملكم الشركه,Customer Service
حد يرد التقدير المسئول للعميل والله تهريج ياجماعه منكم,Customer Service
السلام عليكم ياتري iphone se GB gold متوفؤ فرع ؟ ؟,Customer Service
ايفون + g وبكام هل عرض ولالا,Customer Service
الفروع بتبقي ولحد الساعه ؟,Customer Service
خطي حد يجي يكلمني يسمع صدي صوت وصوته بيتكرر حطيت الخط تليفون تاني وقالولي الدعم الفني لاقي صعوبه ومش عارف اوصل للدعم الفني حد يساعدني,Customer Service
Vodafone Egypt مواعيد العمل الجمعه فرع جولف سيتي العبور هيبقا الساعه لكام ؟,Customer Service
جددت باقه سوبر كونكت وجالي عرض باقتين بسعر باقه لما الباقه تخلص هاخد باقه تانيه يتخصم الرصيد ؟ ؟ النظام,Mobile Data Plans
نظام الدبل والسرعه وحشه جدا العلم عرض جيجا سريع جدا,Mobile Data Plans
وتصفح فيس وملهش وخلاصت ودي التاني وقله تمام استهلاك % حرام والله بقتين حرام والله وتصفح باقه بي جنيه,Mobile Data Plans
شغلت خطي الامارات ودخلت النت هتحاسب مانا مصر الاسعار هتختلف,Mobile Data Plans
عرض % باقه النت هيرجع امتا ؟ ؟,Mobile Data Plans
سمحتو كنت جايب خط نت والباقه خلصت اجددها ؟,Mobile Data Plans
سحبت الميجا وفاضلي,Mobile Data Plans
