Tweet,Topic
والنبي اشحن كارت احول رصيد رصيد فعلا بيقولي لقد نفذ رصيدك شاحن حالا ويقولي لقد نفذ رصيدك برجاء الشحن ومش عارف اكلم خدمه العمله زهقت والله حرام كده,Credit
هوا اشترك نظام ضعف شحنتك ؟ ؟,Credit
يافندم باقه دقيقه لوخلصو الميعاد وحضرتك قولتلي تشحن بي جنيه دقيقه برضو يخلصو فتره السماح شاحن خمسه الشهره يخلصو برضو خمسه بعده ولالحد الدقايق ماتخلص,Credit
"اشتركت نظام اليومي جنيه ميكس , اتوماتك بيسحب جنيه ؟ ولو حبيت الغي الاشتراك الغيه",Credit
باقي كم دقيقه يعد المكالمه,Credit
تيجي رساله استهلاك % الباقه السرعه القصوي وادخل الغي الباقه تيجي رساله مشترك افهم بيحصل,Credit
اذنكم ياريت مساعده ضروري اشتريت كرت شحن بخدش الكارت ارقام اتمسحت مش معايا رصيد اكلم خدمه العملاء ياريت تساعدوني لاني محتاج اشحن الكارت,Credit
هوانا بشحن وبعدين باقه نت يقوللي يتم تجديد الباقه لعدم وجود رصيد كافي ؟ ؟,Credit
طريقه الشحن السريع ؟ ! !,Credit
نصبتو عليا جنيه خلتوني داخل شهور مبشحنش الحركه ومشغل خط,Credit
حضرتک کل ماحول رصيد الکون تون يتفعل معا نفسو عاوﺰ الغي الکون تون,Credit
الفاتوره شهريه بكم وبتدايك كم دقيقه وشبكات التانيه,Credit
هل خدمه حد يبعتلي رصي الخط واروح استلمه كاش الفرع,Credit
جاتلي رساله جنيه هيجيلك رصيد جنيه حولت ومفيش جت الاشتغاله ينفع كده,Credit
سافرت عمره بخط وكلموني هنا برده بيكون سعر الدقيقه,Credit
خط بيعمل عادي السعوديه اخذته معايا وكام سعر الدقيقه وهل يتم خصم المتصل,Credit
احول رصيد خطتي لخط تاني برضو علشان اتعامل شركه,Credit
معايا كارت شحن اشحنه اتصل برقم لان خدمه * * الكود # مش شغاله,Credit
معايا جنيه رصيد وعايزهم كاش اعملهم ولو مينفعش احول رصيد لشبكه تانيه,Credit
فكره التليفون نت وﻻ اغنيه اﻻول وﻻ خالص ولغايه امبارح دقيقه مجانيه انهارده اﻻقي جنيه مسحوبين الرصيد تفسير,Credit
شوف شغلكوا والاخطاء الفواتير وبعدين اعملوا مسابقات براحتكو,Credit
الخير بشحن شويه والرصيد بيتخم الغاء العروض بتاعت المسابقه,Credit
بيجليي رسايل اختبارت الصحه تاخد مني الر صيد وعايز الغيه فضلكو وكمان مشكله شحنت جنيه جت رساله رصيدي خلص مستعملتوهش,Credit
سمحتوا عامل باقه سوبرسوشيال وعاوز الغي استخدام المواقع الغير مجانيه بتسحب الرصيد بطريقه رهيبه وشكرا,Credit
سالف,Credit
يا فندم هدايا بتيجي خالص لما بشحن,Credit
خط اتصاﻻت بشوفه بيتباع العريات التابع ليكم الميداين بيبعو خط بي جنيه وبيقولو لما تشحن الخط بي جنيه بتاخد دقيقه لي ارقام دقيقه لي شبكه اخره جنيه رصيد فا حقيقي ياريت حد يعرفني,Credit
شحنت كارت واداني مسج error حاولت لي لقد استخدام الكارت,Credit
فضلك ياريت تفاصيل شحن كرت العيله وهل الرصيد ببعته للرقم مده محدده وبينتهي مفتوح لغايه مايخلص وشكرا,Credit
جايبه خط جديد ومعرفش نظام بيجيلي جنيه شهر اشحب جات شهرين وبعدها مبقتش بتيجي وعاوزه نظام حلو اشترك,Credit
احترامي ليكوا فعلا انتوا كرهتوني اشحن رصيد الخصم شويه بتخصموه بدون داعي حقيقي الموضوع زاد اوي الفتره حده,Credit
معرفش الرصيد بيتسرب فين,Credit
معايا كارت رقم اتنين اتخربشو ومعيش رصيد رقم ارضي ؟,Credit
كنت واخد دقيقه المهم بتكلم فصل الخط اتصلت تاني خصمو تمن المكالمه وبعدها اتصلت بردو خصمو افاده الخصم معايا دقيقه ! !,Credit
اشحن رصيد باستخدام الفيزا م النت اللينك Etisalat Misr,Credit
عرض اضعاف شحنتك الدقايق هتفضل لحد ؟ لما تخلص ؟,Credit
معايا ج رصيد باقه كونكت الضعف سوشيال وباقي الرصيد باقه ترفيه ج اسبوعيه بدل الرصيد بيتسرق هل عملت باقه الضعف عملت باقه اسبوعيه كده الضعف هاتتلغي وهاتفضل باقه,Credit
نظام شحني جنيه,Credit
ازنكم علشان استلف رصيد,Credit
يافندم اقفل الرصيد علشان داخل النت الباقه بلاقي الرصيد بينقص,Credit
ازنكو احول رصيد لشخص اخر ازي وكل احول رصيد الخدمه متاحه لك,Credit
كنت احول رصيد لاي حد علشان لما بدوس * * الرقم * التحويل #مبيرضاش ويقلي متاحه لك اني كنت بحول كنت احول وارجو سريعا مروح الشغل,Credit
فضلك احول رصيد,Credit
اكواد الاستعلام رصيد حكايه ولوانا ازود رصيد ماميعاد الباقه يجي,Credit
احول دقائق لشبكات الاخره الئ هئ الدقيقه دقائق علئ نظام حكايه,Credit
السلام عليكم خطي قرش للدقيقه,Credit
سمحتوا جبت كارت ومكتوب #الكود * * هيديني ميكس دقايق وميجا هشترك الشحن اشحن,Credit
شحنت كارت بعشره الخط لخدمه سلفني خمسه جنيه ولما مكالمه الرصيد خلص خايفه اشحن تاني الرصيد يروح برده,Credit
عرض الدقائق المجانيه كرت الشحن تحويل دقائق لي خط تاني,Credit
معايا خط موبايلي وشغال شبكه ازي اقدر اشحنه كود,Credit
لما بيكون معايا رصيد فاتح الباقه بيؤتيحب كله حل ضروري,Credit
اشحن رصيدي ببطاقه الفيزا البنك الاهلي Etisalat Masr,Credit
اشحن خطي بالسعوديه واشتريت بطاقه شحن موبايلي وما استطع شحن الهاتف,Credit
كرت شحن وقع بالميه وراح الكود استفاد الكرت انسي,Credit
ارجع خاصيه الرصيد الباقي يظهر المكالمه ماتخلص,Credit
احول رصيد تلفوني اتصل,Credit
حضرتك لما بشحن جنيه بيقولي تمت اضافه جنيه رصيه مجاني ولما برن حد بياخد الرصيد ؟,Credit
حضرتك لما بشحن كارت بيتم خصم رسوم دمغه الكارت,Credit
اشحن رصيدي خط بره مصر ?,Credit
اشتريت كارت وباظ منه ارقام النص اتخدشت جنيه بحالها,Credit
اسعار الكروت ؟,Credit
اشحن كارت وتاني الاقي رصيد واشتراكت باقه وجالي رساله اني اشتركت وبعد ساعه جالي رساله اني فسل تجديد الباقه,Credit
اخرج المسابقه بدل شويه خصم الرصيد,Credit
مشترك باقه نت ومشغل عرض الصيف كمان حولت رصيد لقيت النت بيسحب الرصيد نفسو اراجع استهلاكي بيديني خطا وعلي النت كمان,Credit
وسيله اقدر بيها فاضلي جنيه الاضافي خدتهم الشحن ؟,Credit
شحنت كارت وعاوز اشحن شحنه اعلان محمد رمضان ياريت شرح,Credit
بقالي كذا بشحن وكل ماجي افتح باقه الاقي الرصيد بيتسحب اني مش مشتركه خدمات تانيه,Credit
"السلام عليكم هل يوجد تطبيقات لاتصالات نظام الاندرويد ( تطبيق my , وفلوس ) وكم رسوم تحويل اموال رقم لرقم ثاني ( مشتركين خدمه فلوس ) شكرا مقدما",Credit
كدا شحنت بعشرين جنيه وفاضل جنيه واتسحبو وسحبت جنيه وسحبتوهم بردو وسحبت تاني جنيه وبردو سحبتوهم مني رد العلم اني متكلمتش جنيه مكلمه وحده,Credit
ياباشا حولت رصيد قالي رصيدك خلص رصيدي,Credit
حضرتك مل بيتخصم مني فلوس معرفش نظام ! !,Credit
انتوا بتسحبوا الرصيد بدون مكالمه اشترك خدمه Etisalat Misr,Credit
لما باجي احول رصيد برنامج ماي اتيصالات بيقولي ارجوك قم بالاتصال بالموبايل انتر نت اسم ادخل طريق الدخول السريع,Credit
كنت عامل باقه ولما كنت بفتح البيانات بيخصم قرش للميجا السبب معاي رصيد ودلوقتي خلص والباقه مخلصت,Credit
سمحتو عندر رقم شحنت جنيه ودلوقتي بيقولي رصيدك جنيه,Credit
سمحيت احول بيها الرصيد تلفون تاني لتلفون,Credit
شكرا لحضرتكو شكرا لحضرتكو خدمه اختبارات الصحه اتلغت يريت تشفولي حكايه الرصيد,Credit
السلام عليكم عامل باقه جنيه جبت كارت شحن وشحنته الباقه اتجددت ومالقتش رصيد خالص جبت كارت تاني جنيه برده الرصيد طار برجاء ؟,Credit
بتصل * #لتحويل الرصيد يقولي الخدمه متاحه لنظام خطكوكمان باقه السوشيال اليوميه بتجدد لوحدها,Credit
لما بحول رصيد لرقم تاني بيقولي عفوا مشترك عرض العشر سنين الهبل احول ❕,Credit
سمحتو شويه يجيلي منشت صغير كده يقولي تكلفه المكلمه قرش رصيدك المتبقي كذا قرش ومبعرفش بيخدو الفلوس وكل تحصل الحكايه معدل مرتين وللا اتصلت بخدمه العملاء قالولي مشترك كذا خدمه قولتله احذفهملي قالي حذفتهم ولسه بردو الفلوس بتتاخد مني زهقت خالص المساعده يااما ارمي الخط دا احسنلي واشتري خط جديد,Credit
الخير حضرتك الرصيد عمال يتاخد مني الشركه بتبعت رساله وتقولي خدوا تالت اشحن وياخده دقيقه واحده ياريت حضرتك تقولي السبب وتشوفلي حل,Credit
"اذنك جنابك لما اجي احول كريدت يقولي sorry , youve exceeded the maximum balance of transfer for today بقي",Credit
معايا جنيه واشتركت باقه كونكت بعشره جنيه وخدوا كلهم معرفش,Credit
اناكل شحن لازم ملقيش باقي الرصيدمع العلم اني معملتش ولامكلمه شكرا,Credit
سمحتوا لما باجي اتكلم وبخلص المكالمه بيكتبولي ليك دقائق لبكرا الرصيد هوا يظهر ولما باجي استخدم خدمه سلفني بيكتبولي عفوا الاشتراك الحالي,Credit
اهرف الكود بحول بيه الرصيد,Credit
سمحتو هل عرض اختار شحنتك المكسات بيخصم الرصيد تعتبر هديه الشحن,Credit
كيف الرصيد خط داتا,Credit
عامله باقه بيخدوا الرصيد العادي وازي امنعه,Credit
كنت استعلم الرصيد,Credit
شحنت ج وعملت باقه بال ج وتم التجديد واحولت ج وجاني اني رصيد وNUM قرش وبعد اشويه جاتني رساله رصيدي اقل ونص اقدر استلف راحت فين الخمسه حولتها,Credit
كيف رقم شريحه حاله ابعت رصيد كود علشان رقم الشريحه,Credit
مستلف جنيه واستخدامت جنيه شحنت هيخسم,Credit
دلوتي بدخل كروت فكه بتتسحب اتكلم حرم كده ومينفعش اكده,Credit
ينفع اقسط وادفع الفرع يخصم البطاقه الائتمانيه الخاصه بي التابعه للبنك المصري وهيكون فوائد,Credit
ازي الباقي رصيدي خط USB انترنت,Credit
السلام عليكم حضرتك برا مصر البيت عاملين باقه وعايزين يعرفو ميعاد التجديد والباقه انتهت ام لاء وشكرا,Credit
لما اشحن رصيد بيخلص مبيكملش المشكله اني مبستخدمهوش,Credit
عملت خدمه اضعاف شحنتك واتعملت ودلوقتي شحنت بعشره مجاش دقايق وشحنت ناو مجليش دقائق برده العلم اني كنت مسالفه ج اتصل قالي لقد نفذ رصيدك ودايما بيسحبو الرصيد اسميه بقا,Credit
سمحتو جاتلي رساله اني كسبت ج رصيد لما اشحن ج اشهر واشتركت وفعلا جتلي رساله اني اشتراكي وشحنت مجتش ج هتيجي وهستخدمها رصيد عادي دقايق,Credit
تحميل خلالي اشتريت عالنت خالص اشحن كارت ويخلصوا افهم الفلوس بتروح فين مبتصلش بيها خدمه الكول كيبر بتبعتلي اني مشترك عمرك اشتركت خدمات,Credit
كنت شاحن لقيت رصيدي معرفش,Credit
احول رصيد تليفون لتليفون ؟,Credit
احول فلوس ؟ !,Credit
كنت اشوف مستلف وباقيلي اسدده,Credit
شحن كارت بعشره جنيه اتكلمت منه اربع دقايق والصيد خلص افاده,Credit
الخط بتاعي لسا شاحن وبتصل يقولي مبالغ مستحقه الخط جنيه السبب ! ! ؟,Credit
اذنكو الكود بيجيب رساله الرصيد المكالمه وسعر تكلفتها شكرا,Credit
الشركه سرقت مني رصيد كذا وكلمت خدمه العملاء كتير ومحدش اهتم رصيد تافه يتاخد مني بدون حق الصحافه وممكن اخرب الدنيا بمنشور همشي معاكم قانوني,Credit
احول رصيد خط خط اخر الكود,Credit
شحنت والشركه جددت باقه السويشال معايا رصيد زياده وبعدين اتفاجت رصيدي كله خلص لما بفتح النت,Credit
لوسمحتوا بعت رساله ل عرض ضعف الرصيد وقلولي مشترك اتكلمت الرصيد,Credit
شحنت كارت ومش كنت مستلف اتخصم كله وشحنت تاني ونفس الحكايه بقا ؟ ؟,Credit
اشترك خاصيه رصيد الفيزا رصيدي ينزل المكانه تجي رساله اشتراك,Credit
يافندم خارج مصر وعاوز مكالمه الخط ميتوقفش ومش معايا رصيد للاسف ؟ ! ! اشحن الرقم ؟,Credit
رصيدي وتكون مجانا وخدمت الكول الكبير غليت,Credit
جبت كارتين ومفيش راضي يشحن الصبح كنت محتاج مكالمات ضروري ومفيش رصيدعايز حل المشكله ومتبعتوليش اللينك الخربان بتاعكمربنا يسهل عليكم,Credit
الغي اضعاف رصيد بيخادو العشره جنيه لما بشحن ؟ ؟,Credit
معايا رصيد قرش وشحنت لقيتهم قرش فوق الكارت شحنته العلم معملتش بيهم,Credit
موبايل اخويا ‏ peria z ‏ وكل لما يشحن رصيده يخلص لوحده ومش مشترك خدمه,Credit
كنت لما بشحن بيبعتولي جنيه رصيد ناو لما بشحن ميش بيبعتولي جنيه بقي ؟ ؟,Credit
لوسمحتم خط كنترول جنيه اعر الرصيد وباقي الشحن,Credit
المكالمه لاتصالات بقت بجنيه يخصم دقيقتين وباقي المكالمه ببلاش فضلك كده هيخصم جنيه ولاهيخصم الرصيد والمكالمه دقيقهوشكرا لحضرتك,Credit
شاحن امبارح جنيه عامل نظامي بالثانيهوكنت اتكلمت قرش النوتهواتكلمت دقيقتين لاتصالات فقطودلوقتي معايا فين الرصيد بقا,Credit
احول رصيد لاتصالات,Credit
رصيدي راح فين بحط الكارت هنا مبلاقيش منه بقا !,Credit
اذنكوا مقدار الفلوس استلفتها خدمه سلفني,Credit
جايب خط السنوي وعايز الارقام تعرفني فاضل رصيد وهل الرصيد بينضم بعده وشكرا,Credit
جبت كارت ج وملقتش معايا ج ومكنش استلاف وهقدر ارجعهم ؟,Credit
حضرتك بيتخصم مني رصيد الغي عرض السحب فلوس والكلام تفدني,Credit
اشتركت باقه اضافيه اكسترا ومش شغاله وبتاخد الرصيد فممكن تفسير,Credit
امبارح شحنت جنيه والنهارده لقيت الرصيد جنيه بقي ! ! والحكايه بتحصل كتير الفتره,Credit
امل بلاقي الرصيد ضاع والله بيكتبلي جنيه + قرش,Credit
انتو شركه حراميه شحنت انهارده قالي اني مستلفه والمفروض اسدد ج كمان والله استلفت وكمان والاستلاف الحد الاقصي ج استلاف,Credit
كو د تحويل الرصيد ضرو ري,Credit
احول ازي رصيد تليفوني لتليفون تاني,Credit
عامله نظام حكايه ل والمفروض دقايق الشبكه الاخري بتخلص بسحب دقايق وبتحاسب اضعاف والباقه دلوقت دقيقه واجي اكلم شبكه تانيه يقولي رصيدك خلص,Credit
مشتركتش فعروض youm yallakora وانتو عمالين تسحبو رصيد رصيدي يرجعلي ؟,Credit
محدش رد استفساري سالتكم كده سمحتوا طلبت # * واشتركت عرض بجنيه والشركه اتاخرت عليا فطلبت # * تاني واشتركت العرض دقيقه بجنيه فالشركه قامت ردت وبعتتلي رسالتين ثواني وخصمت رصيدي ثمن الاشتراك العرض مرتين بدل العلم اني مينفعش اشترك العرض واحده مينفعش اشترك عرض مرتين فعلي اساس الشركه خصمت مني تمن العرض مرتين,Credit
نظام خط الصعيد اجي احول رصيد الخط خط اخر الخدمه متوفره لنظامك,Credit
كنت عامله خطي باقه حكايه ج والمفروض ضعف الرصيد قالو لما يخلص الاساسي هل رقم للحصول الرصيد الاضافي,Credit
مستلف رصيد مخلصتش قيمه الاستلاف وشحنت كارت هل هيخصم المبلغ استلفته كله,Credit
اسال عامله الخط جنيه ولما بشحن الرصيد بيظهر وبعد فتره فيش بتيجي,Credit
الرصيد بيخلص خدمات معرفهاش,Credit
احول رصيد لخط تاني بيقولي حولت كتير احاول تاني محولتش اصلا,Credit
استعلم رصيدي اد اتصل ؟,Credit
i can not find link to recharge with credit card Etisalat Misr ( community ),Credit
نظام فريهات واستخدمت رصيدي جنيه ولسه مبعتش رساله الهديه,Credit
معيش رصيد خالص كرتين كرت وكرت هيبقو يكفو يعملو الباقه زياده,Credit
هياخد مني فلوس الرصيد خاطر اصاله هولع الشركه وهولع فيك يادمن وهولع اصاله نفسها وهولع نفسي اخترت ✋,Credit
كود الغي بيه شئ مشترك الرصيد بيخلص دا لرقم تاني,Credit
سمحتو جالي تحو يل رصيد بالغلط وعايزه احوله تاني بدخل الايقونه بتاعت قائمه الموبايل وبعمل خطوات التحويل وكل يجيلي رساله غلط,Credit
رقم تحويل الرصيد,Credit
الرصيد,Credit
اشتريت خط جنيه رصيد شهر اشحن بعشره جنيه يديني ميه شهر جت الهديه كده مجتش,Credit
شحنت الباقه وباجي اخش google search بيقولي الرصيد كافي,Credit
الغي رساله الرصيد الدقايق الباقيه المكالمه بتسحب الرصيد,Credit
كود تحويل الرصيد,Credit
ياجماعه محدش يعرف الغي اشتراكي خاصيه النصائح بتخصم الرصيد ؟ ! الرساله,Credit
سمحتوا الغي اشتراكي مسابقات واخدين رصيدي والكارت مبيقعدش معايا نص ساعه وطلبت ‎ * ‎ # ‎ طلعلي رصيدي كله ضايع المسابقات الغي اشتراكي مسابقه,Credit
اذن حضرتك احول رصيد فوني ل فون تاني الكود اذن حضرتك حضرتك قولتلي لعملاء الكارت الخط هحول منه واليه كارت اضغط # * عملت م حضرتك قولت كده ومش يحول failed failed failed failed failed اذن حضرتك,Credit
الغي خدمه رنلي النوته لوخلص رصيدي يقولي عفوا ميقوليش خدمه رنلي النوته,Credit
بحاول احول رصيد وبيقولي ناسف لعدم تنفيذ طلبكم الخدمه متاحه لك ؟ ؟,Credit
موضوع كارت الشحن هيجيب رصيد جنيه دا صح ؟ ؟,Credit
رصيدي بيتسحب استهلكه كدا ومش مشتركه بتكلم منه,Credit
اقل تحويل رصيد,Credit
هوا متكلمش النوته ويتخصم مني رصيد اخر قرش والمره قبليها قرش كدا بقي حرام,Credit
امبارح حولت النظام بتاعي واتخصم رصيدي رسوم التحويل ولسه نظامي القديم,Credit
لما اكون مشترك واشحن خطي اتكلم بيتسرق الرصيد ؟,Credit
احول رصيد خطي الكود المفروض ينكتب الرقم بسرعه فضلك,Credit
الرقم رقم المسج ابعت اني مدخلش فيس واتس وماخصموش الرصيد,Credit
ممکن اللنك عایز معلومات الخط بتاعی زی الرصید المیجات والباقه کده ممکن اللنک,Credit
اشحن رصيد لرقم تاني,Credit
اشحن رصيد بقول اضافه رصيد مجاني كيف يتم استخدام رصيد مجاني,Credit
احول رصيد,Credit
اجي احول رصيد لخطي التاني ميرضاش العلم باني مشترك عروض وبتظهري رساله الخطا plaes use a correct message format to this service فيدوني لاني محتاج احول بسرعه,Credit
خطي كنترول وشحنت امبارح والرصيد وصل الباقه متجددتش الرصيد افهم بقي ؟ ؟,Credit
استلفت جنيه وعاوزه ارن دولي مبيرنش بيقولي الرصيد خلص,Credit
شحنت ومعاي رصيد جنيه ومش عارف باقه جنيه نت,Credit
فضلكم شحنت شهر بعشره جنيه ونفذ الرصيد الرغم انني اتصل باي رقم وذهبت للاتصالات لي لغيت لك شيء كنت مشترك كده فقلت حشن بخمس جنيهات وتم بالفعل وقلت نفذ الرصيد اتصل بهم لوسمحتم العمل شكرا لتعاونكم,Credit
احول رصيد احول الخط نظامه كروت عادي مش فاتوره,Credit
كنت اشحن الرصيد بيتسحب,Credit
عوزه رقم تحويل رصيد موبيل موبيل اخر,Credit
معايا خط ووقع مني للاسف فتره جامده م يطلع موضوع الخط لازم يتسجل ومش معايا العلبه بتاعته ارجعه محتاجه ضروري ؟,Customer Service
اذنكم هل هتبقي فروع خدمه العملا شغاله العيد شغاله هتبقي لكام ؟,Customer Service
السلام عليكم هل استبدل فلاشه النت السنويه بفلاشه نت واي فاي الجديده,Customer Service
خطوط مسجل عندكم باسمي معرفش عنها وعايز اسقطها الاجهزه عندكم ومفيش فرع قريب مني فرع سفر ساعات الحل والرد,Customer Service
pin,Customer Service
رساله بتظهر اتصل بحد ( تحويلات المكلمات الوارده نشطه ) معني الرساله خالص احترامي MNG,Customer Service
فرع التجمع الخامس والعنوان بتفصيل,Customer Service
مشكله الخط رقم,Customer Service
بضغط * # no reply from ESME يبقا المشكله فين ؟ ؟ ! !,Customer Service
