Tweet,Topic
الرواتر المفروض هايجيلي يبقي كده الخدمه اشتغلت الخط الارضي بتاعي ؟,ADSL
اشترك النت واجيب راوتر المطلوب وايه العروض المتاحه,ADSL
كنتو بتطبقوا سياسه تحسين جوده استخدام عادل ايا المسمي ولينك كده ؟ اقصد هل سرعه adsl الغير محدود بتقل تحميل معين الجيجا بايتس ؟,ADSL
اتصل برقم علشان ادفع فلوس النت الشهري adsl,ADSL
خدمهAdsl مشترك وقالولي الخط تحول نحاس لفايبر وقدمت اكتوبر لحذ النت مجاش,ADSL
بالنسبه لباقه انترنت ADSL تورنيدو لما تخلص جيجا السرعه بتنزل لكام ؟ الخدمه توقف ؟ سريعا,ADSL
عدهاشترك adsl النت بيجي تمام اقدم وعلي مايجي يتفعل اقدم الكتسليشن نمبر وقت التفعيل ؟ المهم اجراءات التوصيل للسنترال تشتغل ؟ والرقم مايطلع اقدمو ؟ ؟,ADSL
اشتركت واستلمت الراوتر ولسه لحد الخدمه وصلتش وبكلم خدمه العملاء يقولوا استني الرساله الموبايل ومفيش وصلت كدا كتير,ADSL
عروض Adsl الجديده,ADSL
السلام عليكم عميل تي داتا ينفع اشترك معاكوا سرعه ميجا لازم انهي الخدمه ينفع خطين خط ميجا ونفس تي داتا اشترك معاكوا ضروري,ADSL
وبالنسبه اقدم راوتر نت تقولولي بالظبط وايه الاسعار بتاع خطوط النت,ADSL
عروض adsl ? ?,ADSL
الباقي م باقه انتر نت ADSL,ADSL
مقدم واستلمت الروتر وماعرفش الخدمه هاتشتغل ولما اتصلت بيكم وادخل الرقم الارضي الرقم غلط ؟,ADSL
خدمه النت اشتغلت قيمه الفاتوره هدفعها وميعاد الدفع لان شهر ليا,ADSL
سمعت راوتر بدون خج ارضي صحيح ؟ واعمل,ADSL
مشغل نت واي فاي ميجا وگنت السرعه مفتوحه محدده,ADSL
مشتركه فيadslوده شهر ودفعت تامين التعاقد هل حيتاخد منه رسوم شهر والا ادفع تاني,ADSL
راوتر اشتريه منين وايه امكانياته وهدفع شهر استخدم انترنت محدود وشكرا,ADSL
الروتر بتاعي بقاله فتره كبيره فاصل حبه اشغله تاني المفروض,ADSL
احول ل سرعه ميجا بالعرض الجديد اروح احول وادفع الاشتراك الجديد ؟ ؟,ADSL
اشتريت خط adsl واستلمت الراوتر الخدمه هتشتغل ؟ ؟ !,ADSL
روتر طريق الشبكه وبيشغل نت مفتوح وبكام واسعار السرعات,ADSL
ركم بتاع النت,ADSL
اشترك راوتر الباقات المحدوده,ADSL
سعر راوتر هاواي Hg e سمارت adsl بكم عندكم,ADSL
اخدت روتر عندكم واشتركت adsl الخدمه هتشتغل,ADSL
حبيت ابقي وكيل لاتصلات adsl مطلوب لان السنترال عدنا الخدمه متوفره,ADSL
الرواتر فاصل عنه النت ارجعه وبيقول تجديد بيانات العملاء وببعت الايميل والرقم ومبيبعتش الكود,ADSL
ادخل النت بالمنزل سرعه منا,ADSL
حضرتك الراوتر بتاعي اغير default port ل بالظبط ؟,ADSL
اغير النت ADSL ميجا ل ميجا هيتغير هوا تجديد السعه الدفع هوا,ADSL
باقات adsl والروتر مجاني النظام ؟ ؟,ADSL
اشتركت Adsl ميجا خصم لمده شهور هدفع مصاريف تعاقد شهر,ADSL
فضلك اسعار سرعات النت ؟,ADSL
مشتري خط انترنت عندكم للاسف سرعته ضعيفه جدا اقل كب دلوقت,ADSL
عروض جديده للانترنت الارضي ؟,ADSL
اركب نت عايزاستفسر,ADSL
ترد عليا مشترك خط نت العرض هوا ميجا تمام بيديني جيجا بايت تحميل السؤال بقا دول تحميل ونصفح تحميل ولما يخلصو بيحصل ! ! وشكرا,ADSL
اجيب خط نت شركه الخط الارضي,ADSL
مشترك سرعه ميجا التليفون الارضي وكميه الجيجات خلصت اشتري جيجات زياده,ADSL
اوصل خط ADSL وعايز اسعار الخطوط ميجا ؟,ADSL
سمحتوا معنديش تليفون ارضي ادخل نت كنت الاسعار,ADSL
كنت فصلت النت شهور مكنتش دفعت الفاتوره فصل لوحده دلوقت ارجعه ؟ ؟,ADSL
عروض Adsl موجوده,ADSL
مشترك خدمه adsl وعاوز رقم ip ثابت,ADSL
اشتركت ADSL وكتبت العقد وادوني الروتر شهر ولغايه ماجتليش الخدمه وكلمت خدمه العمله ورحت الفرع اشتركت خلاله ماوصلتش لحاجه الحل ؟ ! !,ADSL
مشكله النت الارضي اني مشترك سرعه ميجا والسرعه يادوب نص ميجااتصلت اسبوع شكوي قالولي تمام وهنحلها وهيجلك منزليه وكله تمام حد عبرنا لحد الوقتي رقمي,ADSL
اسعار Adsl ؟ وفيه عروض ؟,ADSL
مشترك جديد adsl اسم المستخدم وكلمه المرور يطلبوا مني رقم التليفون يبعتوا رساله ومفيش بتوصل ! !,ADSL
اوصل نت الشركه بسرعه ميجا وتحميا جيجا باشتراك شهري مثل شركه تي داتا ولو ينفع ادفع شهريا ونظام الدفع كيف,ADSL
العروض اركب راوتر واي فاي ؟ ؟,ADSL
مشترك ADSL بالاسعار القديمه التحويل للاسعار الجديده هيبقي المره الجايه هدفع,ADSL
يا فندم اتعاقدت خط adsl واستلمت الراوتر ولسا مشتغلش,ADSL
الخير حابه اسال النت يديني مزايا بيشتغل خط ارضي ويشغل واي فاي اكون مضطره اشغل خط ارضي هل كدا,ADSL
فضلك للتحويل سرعه ميجا ميجا معرفه السعر والباقه المتاحه وهذه الباقه انتهت سرعه تنخفض ضروري,ADSL
adsl البيت وعايز متبقي جيجا ؟,ADSL
قدمت اشتراك نت adsl وقالو لي هيجيلك مندوب هيمضي العقد ومفيش حد جهه,ADSL
اشتركت نت الارضي باقه محدوده ميجا حد رد عليا,ADSL
الرساله بتوصل كتير ؟ خفضت اسعار ADSl لتبدا جنيه للاشتراك زور فرع #طب السؤال ADSL اصلا,ADSL
الخير يبعتولي الراوتر والعقد وحصل اعارف النت هيشتغل امته ياناس,ADSL
مشترك adslعلي باقه موصلتش اقدر السرعه ل واعرف النت هيوصل,ADSL
مشكله وللاسف كلمت خدمه العملاء جدوي المشكله usb باقه دبل وراوتر جهاز يتوصل طريق واي فاي النت يفصل جربت موبايلات مختلفه لاب توب ونفس المشكله,ADSL
اشترك النت الارضي وفيه عروض واسعار الباقات,ADSL
هل عروض متاحه للنت الخط الارضي احتمال عروض قريبا,ADSL
انتو متعمدين تطولوا المده لتوصيل الزفت DSL مليت الانتظارمن فات,ADSL
تاريخ استحقاق فاتوره اتصالاتadsl اقصي فتره سماح متاحه,ADSL
حضرتك كنت مشترك فيعرض النت المنزلي بتاع السته شهور سرعه وعندي الراوتر عليا فواتير لاء وهل غرامات ايقاف الخدمه ؟,ADSL
اتصلت وعملت وجالي الراوتر فات بتاريخ فبراير الخدمه هتشتغل ؟,ADSL
خط نت والداونلود متحدد عايره مفتوح,ADSL
هل امكانيه اني معدل استهلاكي باقه النت الارضي وقت الشهرEtisalat Misr,ADSL
الروتر بتاع بيكون لازم تليفون ارضي,ADSL
معنديش خط ارضي وعايز اشترك dsl طريقه توصلولي بيها النت بدون خط ارضي وشكرا,ADSL
كنت معاد دفع افتوره adsl الخاصه بيا,ADSL
تعملوش عروض Adsl اليو اس بي,ADSL
هل الاشترك لنت لمنزلي للسرعت لمحدوده معه راوتر مجانا تخفيض شهور ؟,ADSL
جبت رقم الالغاء وعاوز اشترك dsl,ADSL
اشترك ميجا Adsl,ADSL
مقدم اشتراك نت منزلي وعايز اعدل البيانات السريع,ADSL
كنت طريقه الموقع ناقص روتر ADSL تليفون ارضي GB DOWNLOAD ؟ عامل انشاء حساب وادخل رقم التليفون الارضي يرفض ويقول اتصل لتحديث الرقم وكده ؟,ADSL
خدمات الدعم الفني لخطوط Adel هل متاحه ? واذا كنت اتاكد جوده الخط الارضي التركيب هل دا متاح عندكم ?,ADSL
كنت عروض للنت المنزلي,ADSL
اجيب الخط المودم الفلاشه واشتغل بيه الموبيل وافعل باقه ميجا ج,ADSL
المشكله انكم اخذتوا فلوس اشتراكي للنت وقطعتوا الخدمه عني بنفس اللحظه وموش عيزين ترجعولي الخدمه فلوسي بقالكم تبقي شركه,ADSL
عرض ج رواتر التليفون الاراضي,ADSL
اشترك adsl العرض الجديد ؟,ADSL
السرعات وسعه التحميل,ADSL
استهلاكي للadsl وميعاد دفع الفاتوره ؟,ADSL
عصام محمد بشكركم خدماتكم المتميزه جدا اسمارت اس شكرا لخدمه العملاء الشركه,ADSL
بخصوص adsl عملت للراوتر ضبط مصنع هيروح اشتراكي الشركه ؟,ADSL
ازي اشغل خط النت اتصل,ADSL
هقدم نت ارضي شركتكم المحترمه الخدمه بتوصلني بازن الله,ADSL
؟ خدمه ADSL رايكم ياجماهير مصر =D,ADSL
خط ADSL العروض الموجوده ومين الموزع مركز الشهداء منوفيه,ADSL
مشترك انترنت adsl وكل شويه النت يقطع ولما بكلم خدمه العملاء بيقولولي كونكشن ولما النت بيجي دقائق وبيقطع تاني الحل بقا ؟,ADSL
حد يرد بسرعه اشترك dsl ومش عارف الاسعار والسرعات,ADSL
Ma na sebna el a mar w gena ll a dr a olna yom w yerkab el net w nothing happened w no one came,ADSL
الروتر الكهربا ذادت وحرقتو يتصلح اعنل,ADSL
كنت اسال عرض باقه وخد راوتر هديه الراوتر هوائي خط ارضي,ADSL
عرض ADSl ميجا ج هل الراوتر wireless لاء ؟ ؟,ADSL
سمحتوا مشترك خط نت adsl عرف استهلكت اد السعه الاستخدام,ADSL
كنت اوصل نت الخط الارضي فكنت المطلوب والعروض والتكلفه العلم الخط الارضي ياريت ضروري,ADSL
العملاء الحالين بسرعه ميجا ADSL وعايز اعلي السرعه ل ميجا بسعر الباقات الجديده جنيه,ADSL
كنت مقدم راوتر ه وجه ولسه الخدمه م اشتغلتش المشكله دلوقت,ADSL
عوزين عروض DSAL,ADSL
خط النت الارضي وكل افتح بيجيب صفحه استكمال البيانات وبيطلب رقم هاتف والايميل والمفروض انكم تبعتو كود ومفيش بتبعت فمش قادر ادخل,ADSL
عاوزين باقه سنويه انليميتيد يااخضر :D,ADSL
اكتوبر وخطوط الارضي اتغيرت نحاس لفيبر ADSL متغيرت منفعش اكمل فدلوقتي بدعم الخطوط الفيبر ليسه ? ?,ADSL
انتم شغلتولي خدمه Adsl الخط الارضي بتعاقد قديم الغاءه ودا نتيجه خطا موظفي الموزع بتاعكم وانتوا قولتوا انكم هتحققوا الموضوع وتجازوا المخطا بقي حقي تعويض الفتره حجزتوا الخط بدون وجه حق وعطلتوني وعطلتوا شغلي دا القرف واللف الفروع ومكالمات لخدمه العملاء علشان تحلوا المشكله انتوا اساسا السبب ودا رقم تليفوني,ADSL
السلام عليكم مشترك خط ميجا ودفعت الاشتراك الشهري ولسه السرعه بطيئه جدا مبيكملش كيلو الدونلود,ADSL
استهلاكي adsl ؟ سرعه ميجا سعه تحميل جيجا,ADSL
اشتركت خدمه ETISALAT ADSL الجمعه فاتت كنت الخدمه هتشتغل ولو اشتغلت هعرف ؟,ADSL
اباشا اقدم تليفون ارضي واقدم راوتر سرعه ميجا,ADSL
اشترك ADCLباقه جيجا سرعه السرعات المفتوحه سعه التحميل والتفاصيل,ADSL
مشتركه Adsl ميجا لي ضعيفه وبطيئه العمل حد يرد عب,ADSL
هوه عرض Adsl % لمده شهور ميجا,ADSL
متوسط سرعه الدونلود ميجا وال ميجا كم حابب اشترك معاكم,ADSL
مشترك جديد بقالي شهر النت موصلش,ADSL
كنت اشترك adsl,ADSL
فاتوره الخط dasl نزلت,ADSL
ازنكم ادخل نت الخط الارضي العروض متوفره,ADSL
البينج عالي ميجا ومش معايا حد الروتر,ADSL
اجيب راوتر سرعته ميجا سعره ميجا سعره وكام ؟ عروض الروتر,ADSL
سمحتو هوا احنا المفروض ندفع فلوس الواي فاي اصل شويه مشاكل النت,ADSL
كنت ازود سرعت خط الADSL لمده معينه وادفع الموجود شبكات ؟ اخلي السرعه ميجا لمده ساعه !,ADSL
كيف عمل شبكه عامه فوق منزلي كيف التواصل معاكم,ADSL
مقدم الADSL شهر ونص ولسه لحد موصلتهوش امل النت يوصل السنه الجديده :,ADSL
ادفع شهر ADSL ادفع ؟,ADSL
عروض النت اوصل طريق التلفون الارضي,ADSL
مشترك ميجا وعايز اخليها ميجا ومعاد الاشتراك ولو اتعملت ينفع ارجع لي ميجا تاني وازاي اغير الاشتراك لي,ADSL
امبارح سالت هنا وعلي customer service استهلاك الجيجا ADSL ومحدش رد عليا,ADSL
اتصلت الاشتراك خدمه النت ودوست هشان اكلم العملا قالي ادخل رقم التليفون دخلته قالي غلط رغم صحيح الحل ؟ اشترك النت,ADSL
howa ana dlw ty Etisalat ADSL tmam mb = gb tmam ? ana azay a rf fadly kam gb we keda ? feh mawk we keda wla eh ?,ADSL
Adsl ميت وبيتحاسب حرام علينا الفلوس بندفعها والله,ADSL
قدمت اشتراك adsl وقالولي هنتواصل معاك العيد ومحدش كلمني,ADSL
كنت اركب adsl المهم فعلا اشتركت واخدتوا البيانات وبعدين واحده كلمتني قالتلي مندوب هيجي يركب الخط ومحدش جه لحد ! !,ADSL
عروض نت,ADSL
انظمه النت التيلفون الارضي,ADSL
موصل خط نت adcl سرعه ميجا Downstream Upstream Data Rate kbps معناه السرعه بالضبط,ADSL
مشكله بظبط اعدادات الروتر وبيعمل كونكتد وبيديني بنج بكلمكم فتحت الفيس بوك بخناقه ومافيش تانيه بتفتح جوجل الاعدادات الصحيحه للروتر VPIVCI Service list Port binding Connection type NAT Service type Encapsulation mode الخ,ADSL
بخصوص لمبه الdsl الراوتر مش بتثبت شويه تشتغل واحيانا تفصل كده نفسها السبب,ADSL
حضرتك السرعه ميجا الاستخدام جيجا,ADSL
مشتركه باقه ADSL social وعايزه احول الدقايق الاتصالات لدقايق شبكه اخرا,ADSL
الشترك ADSL,ADSL
سمحتو اشتراك idsl بيبقي شريحه موبايل خط ومحطوطه داخل روتر بيبقي توصيلها طريق التليفون الارضي,ADSL
حضرتك عملت ل ADSL ومفيش حد كلمني لحد حد اتصل بيا رغم اني سجلت الموقع,ADSL
خط ميجا محدود ؟,ADSL
بصراحه شركه رديئه جدا سرعه النت واسجابته خدمه العملاء غلط اني عملت باقه لشركه المستوي الخدمه وغلط لما موزع معتمد اقنعني بالاشتراك Adecl يومنا الخدمه مشتغلتشي بصراحه اكبر غلطه,ADSL
استلمت الراوتر والخدمه اشتغلتش وكل اتصل يقولوا ل شغلي كله عالنت وماينفعش اقعد نت,ADSL
فضلك تعاقدت adsl ابريل والمفترض وفقا لكلام خدمه العملاء اثناء التعاقد فتره التركيب وحتي ابريل تصلني الخدمهو بتابع رقم المتابعه جاري التركيبانا بدخل النت فقط بباقه السوشيال وقاربت الانتهاء ومش هتمكني اني افتح لينكاتارجو وضع التركيب الاقل مشكله هتستغرق وقت,ADSL
مقدم ADSL ودي تجربه ليا مصر والخدمه مشتغلتش ياتري انطباعي ! ؟,ADSL
اوصل راوتر التليفون الارضي,ADSL
حضرتك اشترك ADSL اروح فرع اروح فين بالضبط وايه الباقات المتاحه,ADSL
سمحتو اركب نت واي فاي البيت الاشتراك والسرعه,ADSL
مقدم dsl وعدت فتره بدري وقدمت استعجال وقعد ساعه وكل اتصل تقولولي يتم استعجال تمت ياريت يبقي اهتمام كده,ADSL
مشترك خدمه adsl بقالي مستلم الراوتر ولحد الخدمه وصلتش,ADSL
المنطقه بتعتنا مفيهاش شبكه تليفون ارضي هل طريقه اوصل بيها انترنت ؟ !,ADSL
اشترك بباقه نت سرعه ميجا للبيت,ADSL
كنت هل اماكن مبتوصلش لهم adsl,ADSL
راوتر اصالات يحون طول مش باقه,ADSL
اجيب راوتر سرعته ميجا هيجيب سعره ميجا سعره وكام ؟,ADSL
سمحتو ماهوالنت المنزلي,ADSL
كنت عاايز اسعاار سرعات النت والعروض #من فضلك ومتقوليش خش اللينك يااريت,ADSL
مغيره لنظام حكايه ابو جنيه ثلاث واشتغلت الباقه حلو بتصل لقيت الباقه اتلغت حرام يضيع الفلوس استفيد بيها,ADSL
اشترك نت البيت فكنت سعر وسعر ميجا ؟,ADSL
بينزل الليميت جيجا بتوع adsl سرعه ميجا هل جيجا بينزلوا الفاتوره تاني ؟,ADSL
انتو بتوصلو النت طريق كبلات الفايبر محافظه المنيا ؟ ؟,ADSL
كنت عروض DSL,ADSL
حضرتك هيا خدمه عندكم راوتر وباقه انترنت شهريه للروتر ؟,ADSL
اشتركت خصيه دقيقه قرش معايه باربعه جنيه رصيد اشتركت قلولي معاك قرش رصيد ومش عارفه رصيدي راح فين,ADSL
الفيس بوك اصبح الدخول عاليه ببلاش ايهInternetorg by facebook,ADSL
مشترك جديد بخدمه ADSL وعاوز حساب الموقع لمتابعه الاستهلاك بعمله اصدار الفاتروه التانيه ليا وشكرا,ADSL
منين ليكم الحق انكم تخفضو المساحه الاستخدام Adsl ل جيجا بدون الرجوع لصاحب الخط,ADSL
معي Usb بشحنها بيديني جيجا ونص فتره اساسيه وجيجا ونص فتره اضافيه باليل خلصت معي احول لنظام تاني وعاوزه النظام اعلي ج جيجا واحول,ADSL
شكوي تعاقدت ADSL فتره طويله تصل الخدمه سوهاج,ADSL
خدمه واي فاي البيانات,ADSL
باقات اتصلاتadsl للخطوط الارضي الغير محدوده مزاياها واسعارها,ADSL
سرعه ميجا الغير محدوده تطبق سياسه الاستخدام العادل مفتوحه الاستهلاك طوال,ADSL
قدمت روتر الجمعه فاتت ولسه مجاش النت كده الشبكات التانيه تاني النت بيجي,ADSL
النت بيفصل ويفتح مرستر روتر عملت الحل ؟,ADSL
سمحتوا عروض النت DSL بتاعتكم والاسعار والسرعات ؟ ؟,ADSL
قدمت خدمه ADSL هتيجي كد,ADSL
مشكله دفع الفاتوره بتاعت النت adsl ومحد ش رد customer care,ADSL
مشكله معاكم خط النت وحش البيت,ADSL
روتر السرعه ميجا اخليه ميجا شهريا اغير السرعه,ADSL
USB باقه ج الباقه خلصت والشهر مخلصش اجددها بليز رد,ADSL
معي راوتر النت الهوائي والباقي محدود بوقت معين هل تغير استخدمه ساعه بدون وقت محدد,ADSL
كنت مقدم خط Adsl بقاله ومحدش كلمني استلم الراوتر وتفعيل الخدمه,ADSL
"خطي فاتوره مفتوحه , ينفع اشترك عرض DSL RED ?",ADSL
اشتركت والرواتر جه وقولولي الشحن بيكون طريق اتصلت قعدتت ترغي ومعرفتش اﻻفاده,ADSL
Vodafone Egypt خدمه نت للخطوط الهوائيه,ADSL
سمحتوا بالنسبه للنت الهوائي هل الباقه بتكون مقسمه طول الساعه ص ل م بمعني باقه بتكون جيجا نستخدم منهم جيجا وقت وال جيجا الباقين نستخدمهم فقط الساعه ص ل م ؟ وشكرا,ADSL
راوتر هواني اورانج نوعه pw احول نت هوائي هل لازم اشتري راوتر هوائي الراوتر دا ينفع ولو ينفع احط شريحه عاديه شريحه داتا,ADSL
نظام ميجا unlimited DSL هشترك وايه اقصي حد للداونلود الشهري ؟ ؟,ADSL
معلومات جهاز النت بدون خط ارضيالسعر والاشتراك فالشهر وازاي اقدر احصل وخلال وقت ؟ !,ADSL
الراوتر الهوائي محددين وقت معين للاستخدام نظام كنترول بيدي جيجا بايت الحق اني استخدم جيجا بايت صباحا لحد والوقت كله نوم شغل اني استخدم جيجا بايت طول متاح اني استخدم النت ؟,ADSL
اعارف جهاز الوي فاي للنت بدون فون اراضي تفصيل ارجوالرد,ADSL
امبارح بحاول اشتراك عرض اس ومش مجمع معايا واخر رقم للطلب t a w,ADSL
حضرتك كونت عواز ازي اغير البسورد بتاع الوي فاي ازنك,ADSL
بتصل خدمه العملاء ل adsl مش مفعله ؟ !,ADSL
اشترك نت واي فاي وعايزه الحاجات اجبها الطلبات بعني,ADSL
كونت اشترك AbsL مشترك شركه تاني لزم الغي الاشتراك الشبكه اشتال الروتر واشتراك عندكم,ADSL
فضلت شهور شحنت رصيد والشريحه انسحبت وعايز ارجعها مسجله باسمي,Credit
شحنت واشتركت باقه وسحب واتبقي الرصيد زيهم ازود بيهم اكسترا ميجا,Credit
مشكله احول رصيد جربت ويبعتلي رساله مضمونها عفوا الخدمه غيره متوفره نظامك الحالي نظامي قرش,Credit
عرض للمخطوبين خراب البيوت اهنا دا,Credit
رقمين عملوا تجوال يتحاسبوا لما يكلموا بعص بجنيه برده السعوديه,Credit
لعرض اضعاف شحنتك وايه اجدد عروض الشحن,Credit
لما باقه يقولي استهلكت % السرعه القصوي ياخد رصيدي كده هيحصل,Credit
لما باقه يقولي استهلكت % السرعه القصوي ياخد رصيدي كده هيحصل,Credit
اشحن ياخدو رصيدي كلو,Credit
شحنت جنيه ساعه نسيت اكلم * # امكانيه اني اشترك ؟,Credit
اجدد باقه حكايه العلم اني معايا رصيذ والميعاد جه ولسه متجدداش لوحدها ! ! ؟,Credit
هيه العروض نازله بتاعت رصيد جنيه لما تجاوب صح حقيقي,Credit
Etisalat Misr خربشت كرت الشحن طار مني رقمين رقمكم الارضي علشان احل المشكله,Credit
شويه يخصمو مني رصيد خدمه دعاء الغيها,Credit
بطلوا هري بقي اقسم بالله شاحن امبارح جنيه ومافي دقايق جات,Credit
معايا نقط كتير وعليه فاتوره متاخره ينفع ادفع الفاتوره بالنقاط نقطه,Credit
اتصاﻻت احول رصيدمن خط اتصاﻻت باقه مكالمات لخط اتصاﻻت كارت العلم رصيد مجاني وايه الخطوات,Credit
