Tweet,Topic
مشترك تبع رايت والنت بطئ جدا وبيخرج الصفحات لوحده وبعدين ادخل يجبيلي صفحه استكمال البيانات ومبعرفش ادخل الصفحه المطلوبه,Mobile Data Plans
باقتي سنويه وموعدها يومين التجديد شحنت ينفع مشكله وممكن احسن باقات النت لاني مشترك باقه جنيه الشهريه بتبقي تقيله التحميل,Mobile Data Plans
سمحتو عمله باقه نت وشحنت ومجتش رساله تاكيد عيزه الباقه اتجددت,Mobile Data Plans
باقات النت للداتا اكوادها سمحتوا,Mobile Data Plans
عامل باقه النت النت بطي اوي اه الحصال نت اصراع فضلكم مساعده ضروري,Mobile Data Plans
كيفيه الاشتراك بباقه النت,Mobile Data Plans
شحنت باقه جنيه والباقه ماجددتش انتهاء الباقه بيوم شحنت كمان اربع كروت,Mobile Voice Plans
معاي باقه سوبر كونكت وعايز متبقي ميجا بايت وشكرا مقدما,Mobile Voice Plans
هوا عرض الباقات ؟,Mobile Voice Plans
اشترك نظام اهلا بالثانيه,Mobile Voice Plans
استهلاك الباقه النت نظام دماغ تانيه وازاي كول تون مالميكسات,Mobile Voice Plans
معايا خط نت وخط للمكالمات احول لنظام حكايه نت ومكالمات خط فيهم خط النت المكالمات وشكرا,Mobile Voice Plans
اناعامله باقه جنيه وكل اتصل حد يقولي خدمه رنه عالنوته الغيها,Mobile Voice Plans
عملت العرض م يخلص وجاتلي رساله الاشتراك بنجاح جه بيقولي انتهت صلاحيه العرض باقات كونكتدا معناه,Mobile Voice Plans
اجدد الباقه,Mobile Voice Plans
لوسمحتم كونكت وبعدين لازم الغي الباقه القديمه تجدد تلقائي ولو لغيت الغي # *,Mobile Voice Plans
مشترك كنت وجت رساله العر ينتهي اسبوع التوضيح,Mobile Voice Plans
انتوا خليتونا متعودين اسبوع ينزل عرض نت دا شحنت الباقه مرتين وخلصت الباقه التالته عايزين عروض اسبوع,Mobile Voice Plans
باقات المكالمات المتاحه وعاوزه احول نظام yes ل باقه مكالمات شهريه,Mobile Voice Plans
سعر الباقه زاد والخدمه وحشه معايا ايفون وعايز اخليه Gبدلا G,Mobile Voice Plans
مشترك عرض حكايه ج مارس وامبارح باعالي رساله هتتجدد بكرا ؟,Mobile Voice Plans
احول باقه double ل max بالنسبه ل usb modem وهل مصارف هتتخصم,Mobile Voice Plans
عندی عرض الباقه اللی بنص التمن,Mobile Voice Plans
اذنكم نظام ج طول واتصلت سيتم تحويلكم بعدنص ساعه ومفيش بتيجي فايده نظام ميكس اليومي احول,Mobile Voice Plans
شحنت الباقه قالي جاري تنفيذ طلبكم واتستنيت نص ساعه مجاش اعملها تاني جه رساله بيقولي الغاء طلبك جاي,Mobile Voice Plans
العرض بتاع مكمل شحنت هيخلص ديسمبر,Mobile Voice Plans
هوا عرض الميه خصم الباقه الشهريه,Mobile Voice Plans
باقه كونكت بلاحدود بتفضل شغاله طول فيس واتس,Mobile Voice Plans
سمحتو عرض الصيف بتاع ضعف النت لازم # * اختار الفتر الصباحيه المسائيه,Mobile Voice Plans
امبارح بحاول باقه مكالمات حكايه ومعايا رصيد واكلم واختار عادي وتقولي الباقه هتتغير دقيقه واستني رساله وعملتلها امبارح مرات ومفيش رسايل بتيجي جربت دلوفتي وعدي نص ساعه وبردو بصراحه الخدمه بقت وحشه جدا,Mobile Voice Plans
عرض ضعف الباقه,Mobile Voice Plans
نظام الحفله وكيفيه الاشتراك والافاده اذن,Mobile Voice Plans
اشترك عرض الباقي ابعت رساله مكتوب رقم كم ل,Mobile Voice Plans
نظام حكايه ؟,Mobile Voice Plans
سمحتوا اشترك الباقه بعتولي رساله فشلت المحاوله لوجود دوبل سيرفس النظام اليومي,Mobile Voice Plans
جددت باقه ج وجاتلي رساله بالباقه الاساسيه فقظ يذكر شييء ضعف الميجابايتس,Mobile Voice Plans
شاري الخط جديد وعايز اشترك نظام قرش ومش راضي يشترك,Mobile Voice Plans
مشترك باقه حكايه بتدي وحده تستخدمهم تحب الغي النت,Mobile Voice Plans
اشتركت باقه هاخد ميجا اساسيه ميجا هديه اختار سوشيال ستريمنج استفيد بالاثنين,Mobile Voice Plans
معا خط دايت اغيار الباقه اعمله اعلي معي,Mobile Voice Plans
شاحن باقه كونكت اتنتهي واريد الاستعلام الباقات الجديده,Mobile Voice Plans
عرض خمسه اضعاف شحنتك,Mobile Voice Plans
شهر جيجا بيت وكل شهرادفع جنيه وله ادفع,Mobile Voice Plans
للاسف مشترك باقه انتر نت الفل سريعهفوق الممتازه وللاسف دخلنا اهوه والانترنت ضعيف جدا جدا بعرف افتح فيس بوك هغير لاي شبكه تانيه,Mobile Voice Plans
صلاحيه باقه النت جنيه بتدي جيجا شهر شهور الموبايل الرجاء السريع,Mobile Voice Plans
عرض بيدي ساعه شهريا لاتصالات وساعه للارقام الاخري الاشتراك السنوي جنيه العرض دا اسمه ؟,Mobile Voice Plans
سمحتوا اغير نظام خطي نظام قرش نظام الاشتراك الشهري للاهميه,Mobile Voice Plans
اريد التحويل نظام يخدم اكسترا,Mobile Voice Plans
عرض رمضان طول,Mobile Voice Plans
باقه حكايه والدقايق للشبكات التانيه خلصت ومعايا دقايق كتير احول الدقايق للشبكات التانيه ؟ ؟,Mobile Voice Plans
السلام عليكم الغي النظام واشترك نظام كله قرش,Mobile Voice Plans
بالنسبه لخصم % باقات كونكت العرض مستمر بيجي اوقات واقات,Mobile Voice Plans
اشتركت باقه اكسترا سوشيال وجالي رساله بنجاح الاشتراك بتفتح معايا ؟ ؟,Mobile Voice Plans
عرض ضعف الميجا,Mobile Voice Plans
الاجهزه العروض حضرتك بتكون مقفوله ؟ Locked ? ?,Mobile Voice Plans
يافندم اتصلت وحولت لنظام حكاوي قالي انتظر رساله تاكيد غضون مده نص ساعه بقاله ساعه ومجاتش الرساله,Mobile Voice Plans
تجيلي رساله اتكلم دقيقه وخد تاني نص ساعه ببلاش وبتكلم ومش باخد نص الساعه,Mobile Voice Plans
عرض شاهد بلس اشتركت هايبقا مشاهده مسلسلات ادخل الفيس واتس وكده ؟,Mobile Voice Plans
اذنك خط داتا عرض ضعف الباقه باقات منحز ؟,Mobile Voice Plans
نظام خدمه اقدر بيها اختار رقم لاتصالات اكلمه براحتي طول ياريت نظام كدا,Mobile Voice Plans
اشترك باقه تورنيدو الخط الارضي وهل السعر دائم عرض لفتره وبعدين السعر بيتغير,Mobile Voice Plans
عرض ضغط النظام متاح لعملاء اهلا نظام وازاي احول نظام اهلا,Mobile Voice Plans
احول لنظام ميني كنترول للخطوط الجديده فقط,Mobile Voice Plans
الباقه خلصت معادها الشهري وعايز اجددها شحنت وماتجددتش اجددها نظام حكايه جنيه,Mobile Voice Plans
ميعاد تجديد الباقه فاضل الغي الباقه واشحن واشترك الباقه,Mobile Voice Plans
اشتركت باقه اختار شحنتك دقائق جنيه دقيقه وعايز الغيها ؟,Mobile Voice Plans
هوا اتاخرت تجديد اشتراك حكاوي هيتحسب الجديد تجديد الاشتراك المعاد القديم ؟ ؟,Mobile Voice Plans
مشترك باقه اصاله الغي الاشتراك,Mobile Voice Plans
اشترك عرض دقيقه بجنيه لمده ارب,Mobile Voice Plans
سمحتو باقه مكالمات عامله باقه كونكت ومش اخسر الباقه يبقي شغالين النظام والشروط اتبعها الرجاء للاهميه,Mobile Voice Plans
يافندم عرض هوه بليل ل المغرب دقيقه اعمله ؟ ؟,Mobile Voice Plans
تجديد باقه حكايه ميكس ؟,Mobile Voice Plans
اشترك نقط more بيحصل حاولت كذا,Mobile Voice Plans
الغاء نظام مكيس ورجي نظام اهلا,Mobile Voice Plans
نظام حكايه ودقايق الشبكات التانيه خلصت بكلم الدقيقه كده دقايق جات حد معين وقفت ولسه معايا دقيقه ينفع يتحولو لدقائق شبكات تانيه,Mobile Voice Plans
مشترك نظام حكايه ميعاد التجديد وشحنت يجدد الباقه كود تجديد الباقه ؟,Mobile Voice Plans
شاري خط جديد واشتركت ضعف الباقه حكايه ومجليش ضعف الباقه الحل,Mobile Voice Plans
كنت عامل باقه سوبر سوشيال وجالي تجديد الباقه ولديك شهر عليك وشهر علينا اجدده ببلاش,Mobile Voice Plans
السلام عليكم الفرق باقه السوشيال وباقه الستريمنج ارجاء ارد,Mobile Voice Plans
ينفع اكون نظام دماغ تانيه واشترك باقه سوبر كونكت ؟,Mobile Voice Plans
الغي الباقه الشهريه ازي,Mobile Voice Plans
كيفيه الغاء باقه منيو السوشيال,Mobile Voice Plans
الغي خدمه مسابقه الدينيه,Mobile Voice Plans
سمحتوا اجدد باقه حكايه ميكس اجددها كود التجديد بسرعه فضلكم,Mobile Voice Plans
يافندم مشترك باقه جنيه اسبوعيا قروش هينفع معاها الباقه الشهريه يتم,Mobile Voice Plans
لوسمحتم مني راوتر اشتري شريحه هل هتكون منجز الجديد هاتكون عاديه ولكم جزيل الشكر,Mobile Voice Plans
اشترك عرض كله جنيه ماجي اشترك يقولي العرض منور لنظام خطك العلم كنت مشترك كده,Mobile Voice Plans
خط سمارت كنترول بتشحن جنيه وتاخد لاتصالات وNUM للشبكات الاخري الخدمه لفتره محدوده مدي الحياه,Mobile Voice Plans
لما احول لنظام فريهات هيبقي هديه اوصل لجنيه التوضيح,Mobile Voice Plans
العروض مشاركين شان يشحن والرصيد بيتسحب دايما اتكلم,Mobile Voice Plans
بتكلم كتير نظام مناسب,Mobile Voice Plans
معايا خط داتا ومشتركه باقه منجز وخلصت الموعد وعايزه اجددها,Mobile Voice Plans
اشتركت خدمه اكسترا تكلمت دقيقه احصل ساعتين صباحا الساعه الغي هزه الخمه واشكركم مجهوداتكم الرائعه,Mobile Voice Plans
باقه Super Social Unlimited وعايز باقه اضافيه اكستر هل ينفع ؟ وهل ميجا لجميع المواقع,Mobile Voice Plans
عملتها امبارح وجالي الضعف الضعف هيبقي معايا كله,Mobile Voice Plans
هوا بلس ؟ ؟ وبشترك ؟ ؟,Mobile Voice Plans
الباقه الشهريه اكلم ؟ :),Mobile Voice Plans
بخش لينك اللعبه بيقولي bage not found,Mobile Voice Plans
العرض وازاي اشترك,Mobile Voice Plans
امبارح الباقه ميجا اتجددت تلقائيا نظام الضعف هيبئي,Mobile Voice Plans
بالنسبه للنظام الميجات الاضافيه احمل وبتبقي سرعتها ؟,Mobile Voice Plans
اشتركت عرض ريح بالك دقيقه لاتصالات مجاش ليا رساله تاكيد اني مشتركه برجاء,Mobile Voice Plans
كنت مشتركه باقه كنترول ولما شحنت الباقه اتلغت لوحدها,Mobile Voice Plans
استعملت اد اه الباقه,Mobile Voice Plans
انتو نزلتو عرض الباقه جنيه وعليها سوبر سوشيال لما شحنت وجددت الباقه ماخذتش ميجا,Mobile Voice Plans
عرض ضعف الباقه فاتنه امبارح قله الرسائل امتا العرض القادم,Mobile Voice Plans
اخد الضعف الاشتراك الباقه الاشتراك,Mobile Voice Plans
هشترك جيجا وربع تبقا جيجا ونص بنفس التمن جنيه ؟,Mobile Voice Plans
الغي نظام دقيقه بجنيه #اتصالات مصر,Mobile Voice Plans
فكره العرض فات شحنت الباقه ومجليش الضعف كده واضح بتضحكو علينا,Mobile Voice Plans
نظام حكايه دقايق الشبكات الاخري خلصت معايا دقايق لاتصالات احول دقايق للشبكات التانيه,Mobile Voice Plans
نقاط مور ابدله بجهز بلاستشين فرع شركاء,Mobile Voice Plans
عروض خصومات ضعف الباقه للنت قريب,Mobile Voice Plans
سمحتوا مشتركه باقه مكالمات والباقه خلصت معاد التجديد اجددها تاني,Mobile Voice Plans
اقدر اجدد نظام حكايه العلم اني كنت مشترك معاد التجديد مجاش,Mobile Voice Plans
محول رصيد بي مرتين وعملت باقه شاهد ومش شغاله,Mobile Voice Plans
وكمان الغي اشتراكي حكمت,Mobile Voice Plans
باقه الميني سوشيال المجانيه لمده اسبوع هل ليا استخدام محدد وللا مفتوحه استخدم فيس بوك واتس اب براحتي ؟ وهل الباقه اسبوع ساعه اشتراكي وللا بتنتهي تاريخ معين ؟,Mobile Voice Plans
رد برساله فاضيه لتستمتع دقيقهلاتصالات وميجابايت وكمان دقيقه للشبكات الاخري جنيه صالحه الغي العرض لوسمحتوا,Mobile Voice Plans
سمحتو هوا نظام شهري بيديني اكبر الدقايق للخطوط الاخري وممكن التفاصيل سمحتو,Mobile Voice Plans
عرض شحنه بقت بنشترك وهل الرصيد الاساسي يتفضل بتنتهي فتره العرض,Mobile Voice Plans
سمحتوا الغي باقه الميني سوشيال,Mobile Voice Plans
عامل باقه وخلصت وميعاد تجديدها وعاوز ؟ ؟ جددها تاني لازم استني اجددها عادي,Mobile Voice Plans
هوه عرض ضعف الباقه والا خلص,Mobile Voice Plans
صوم مقبول شاءالله صغير باقه سوبر كونكت نعرف الاستهلاك,Mobile Voice Plans
مشترك حكايه مكس امنع استخدام الفلكسات للكلتون والنت هل يوجد كود,Mobile Voice Plans
نظام سوبر يس ؟ ؟ وعايز اشترك باقه مكالمات شهريه الانظمه المتاحه ؟ ؟,Mobile Voice Plans
عامله باقه بشحن جنيه بيديني دقيقه لاتصالات لاي شبكه بتجدد,Mobile Voice Plans
مشترك باقه النت المحدوده اجدد الباقه ميعادها,Mobile Voice Plans
عملاء كونكت الجدد ؟ ؟ ولو شحنت هتكون بنص التمن وا باليل كنت بعمل باقه وNUM ودلوقتي لاغيه الباقه عملت باقه هتكون بنص التمن ؟ ؟,Mobile Voice Plans
والله حرام بيحصل عملت باقه كونكت وعملت الغاء المواقع مجانيه بربع جنيه جنيه رصيد سرقتوهم شحنت تاني وعملت الغاء المواقع الغير مجانيه تاني مرتين وتخمصوا ربع ومجتش رساله تاكيد واتفجئت انكم سرقتم التلاته جنيه كمان,Mobile Voice Plans
اجدد باقه حكايه ميكس,Mobile Voice Plans
جددت الباقه ضعف العرض ؟ ؟,Mobile Voice Plans
اشتريت امبارح خط وعملت باقه شهريه وقالولي الخط ساعه ويشتغل امبارح لنهارده مشتغلش,Mobile Voice Plans
نظام السنوي بالتقسيط اروح الفرع,Mobile Voice Plans
فضلك مشترك باقه انترنت جنيه الغي الباقه واشترك الباقه بتاع انهرضا الرجاء بتفاصيل مختصره ومفهومه ؟ وشكرا :,Mobile Voice Plans
وكيفيه الاشتراك,Mobile Voice Plans
مشترك باقه هل ينفع الغيها واعمل باقه غيرها واشترك العرض ؟,Mobile Voice Plans
مشترك عرض جنيه شهور فشحنت فجالي جنيه اشتركت باقه وتلاتين الجديده فبستخدم النت فبيسحب الباقه جنيه مددتها وكده هتروح عليا استخدم النت بيها وميسحبش الباقه استخدم جنيه الباقه الرجاء,Mobile Voice Plans
تفاصيل النظام ونظام حكايه بتاع المكالمات كله,Mobile Voice Plans
حضرتك كنت مشترك عرض مودك ‏ الغيه ‏ حضرتك تقولي ؟,Mobile Voice Plans
استعلم باقه النت اتصل رد ازنكم ☺ الاكواد الاستعلام,Mobile Voice Plans
معاد تجديد نظام حكايه وعدد الدقايق اللس فاضله النظام,Mobile Voice Plans
نظام بيزنس ياريت هنا لينكات لان باقتي سوشيال,Mobile Voice Plans
اناشتركت الباقه الجديده,Mobile Voice Plans
حولت حكايه ومشترك كونكت الباقه هتتلغي هتفضل,Mobile Voice Plans
كنت عامل باقه سوبر كونكت وبعدين لغتها باقه جديده ملقتش الرصيد سمحتوا,Mobile Voice Plans
مشتركه باقه نت وعايزه نظام حكايه مجدده باقه النت,Mobile Voice Plans
حولت دقايق الشبكات التانيه باقه حكايه الدقيقه ومع بيسحب الرصيد العادي حاله اني اكلم رقم,Mobile Voice Plans
فضلك تجديد مبكر لباقه حكايه مكس ومش عارف توضيح فضلك ؟,Mobile Voice Plans
اشترك عرض تقسيم لفترات قرش,Mobile Voice Plans
مصر الجمعه ضعف الباقه نصف التمن,Mobile Voice Plans
سمحتوا ي جماعه قلت ميت طريقه الغي الاشتراك عرض دقيقه رساله ميجا وكل مابعت ل ل فشل ولما اجي اتابع اللينك بتقولوا مبيفتحش طريقه ضروري ؟ ؟,Mobile Voice Plans
كيف تغير نظام نظام اخر,Mobile Voice Plans
مشترك باقه السوشيال اليوميه وعايز الغيها اشترك الباقه ويتريت ترد عليا بسرعه,Mobile Voice Plans
مشتركه باقه حكايه وباخد دقيقه لاتصالات دقيقه شبكات تانيه ينفع احول دقائق الشبكات التانيه,Mobile Voice Plans
السلام عليكم باقتي حكايه مكالمات فقط المفترض دقيقه التجديد مباشره ارسال دقيقه فقط اين دقيقه ؟,Mobile Voice Plans
حضرتك الباقه شطبت خالص ومش بتحمل صور ولسه مجاش معاد تجديدها ينفع الغيها واشترك جديده,Mobile Voice Plans
فضلك الرساله وصلتني انتهاء المكالمه ( ( رد تكلم دقيقه لكل الشبكات جنيه ) ) تفاصيل,Mobile Voice Plans
العرض شامل الاكسترا ? ?,Mobile Voice Plans
عرض خصم % انتهي ؟ !,Mobile Voice Plans
مشترك نظام حكايه ازي اخلي الدقيقه لاي شبكه دقايق لاتصالات,Mobile Voice Plans
حضرتگ عرض ( رقمگ المجاني ) خلاله بتقدر تحط رقم بتگلمه مجانا ج وخدمه الفاتوره معلومات الخدمتين دول وازاي احول للفاتوره العلم اني نظام فاتوره وشگرا,Mobile Voice Plans
كونكت كمان ؟ ولو بدري معادي اجدد لازم اخرج الخدمه وادخل,Mobile Voice Plans
اشتركت الباقه سوبر جتلي رساله استهلكت ٪ الاساسيه كدا باقي معايا ٪ معايا باقه الاضافيه,Mobile Voice Plans
كنت مشترك باقه كونكت وجه ميعاد التجديد اجددها قالولي عفواهذه الخدمه غغير متاحه لخطك,Mobile Voice Plans
كنت اشتركت نظام حكايه ابعت منه رسايل sms مينفعش,Mobile Voice Plans
باقه فيديو ومزيكا ببلاش اتلغت والا ؟,Mobile Voice Plans
نظام كونكت ابو جنيه دا بيشتغل انترنت سوشال تفاصيل كامله وازاي اشترك,Mobile Voice Plans
نزلت البرنامج مي ومخدتش الجيجا,Mobile Voice Plans
وعاوز كمان الباقه ام جنيه سوبر سوشيل نظامها والميجا,Mobile Voice Plans
العرض دا ساري الباقه الاضافيه,Mobile Voice Plans
عروض الباقات الشهريه,Mobile Voice Plans
مشكله اشتركت باقه كونكت بالتقسيط ولما بطلب * # وبختار نص النهار وساعات نص الليل بتتسحب الباقه الفري وكله باقه كونكت الاساسيه وحتي جربت ابلكيشن ومفيش نتيجه,Mobile Voice Plans
اشتركت عرض رمضان وعاوزه الرساله الاشتراك بتتبعت الشحن,Mobile Voice Plans
ياجماعه محتاج مساعده الغي الباقه بتاعتي واشحن باقه,Mobile Voice Plans
احول نظام لنظام,Mobile Voice Plans
الباقه الاساسيه خلصت ولسه الباقه المجانيه ميجابيتس هل هستمتع باستخدام الباقه الميجا بيتس المجانيه هتروح عليا,Mobile Voice Plans
العرض ساري طول ؟,Mobile Voice Plans
الباقه منجز تتجدد ميعاد الانتهاء شهور ؟,Mobile Voice Plans
يفع احول الدقايق معايا لاي رقم تاني ؟,Mobile Voice Plans
معايا خط جديد نظام حكايه ميكس بيعطي ميكس اغير النظام ل كله قرش وشكرا,Mobile Voice Plans
اشترك نظام مكالمات بالثانيه,Mobile Voice Plans
حضرتك مشترك باقه سوبر سوشيال بلا حدود السرعه ضعيفه جدا جدا جدا ارجوا,Mobile Voice Plans
انتهت صلاحيه دقيقه نظام فريهات لخطك هل مؤقتا وممكن استفيد بالهديه تاني لازم اخد هديه تانيه,Mobile Voice Plans
ل وسمحت مشكله يتكرر معمل الباقه النت يبقي ويكبيديا يفصل,Mobile Voice Plans
ضعف الميجابيتس باقات كونكت الجديدهاطلب # * ببلاش اسعار وميجابايت باقه ؟ #اتصالات مصر,Mobile Voice Plans
اشترك فل لعرض بياخد جنيه شهريا دقيقه وعايز اشترك تقولي اشترك ازي,Mobile Voice Plans
سمحتوا نظام حكايه احول نظام حكايه وكام رقم التحويل,Mobile Voice Plans
كنترول وعايز احول نظام حكايه ميكس لما بشحن بتتجدد الباقه طول,Mobile Voice Plans
باقه شهريه معقوله تديني الاقل ج ودقايق لاتصالات وللارقام التانيه متدخلنيش لينكات والنبي اذكر عرض,Mobile Voice Plans
اشتركت عرض باقتين بسعر باقه الباقه الاساسيه خلصت معاد التجديد الباقه التانيه هتشتغل ؟ اشتركت,Mobile Voice Plans
عامل باقه سوشيل ميديا جنيه شهريه بفتح فيس الاقي بيتسحب الرصيد عامل باقه بياخدو الرصيد وشكرا العلم شركه احسن الشركات,Mobile Voice Plans
مجدده باقتي امبارح اشترك ونبي,Mobile Voice Plans
ممكين حد يفيدنا ازنكوم احدث عريض الشهريه ممكين رساله فيا التفصيل والاسعار,Mobile Voice Plans
اناشترت خط هوا اصلا معمول نظام حكايه تشحنو ولكن اشترتوا منوقالي نصف ساعه اتكلم علشان العرض يفتح معاك قلت ماشي وبعدساعه ونصف بتكلم لقيت الباقه اشتغلتش روحت للاسنترال قالي اشتركلي جديد الدور اتكلم دقائق وقفلت لقيت الباقه مقرره مرتين بدلامن لقيت هل انالوعملته هينفع تكون مرتين,Mobile Voice Plans
كنت عامله نظام حكاوي ولاغيتوا كده بقا نظام,Mobile Voice Plans
عروض النت المتاحه وياريت فرصه,Mobile Voice Plans
كونت شترك جنيه خط الفلاشه ابعت رساله رقم,Mobile Voice Plans
